{
  "MESSAGE_ID": "MSG-20261007-5e6f7a8b",
  "PROJECT_ID": "RKP-2026-0001",
  "TYPE": "CHALLENGE",
  "FROM": "AG-RED",
  "TO": "AG-WRT",
  "TIMESTAMP": "2026-10-07T12:00:00+00:00",
  "SUBJECT": "قفزة سببية في الفصل 3، الفقرة 12",
  "CONTENT": "الفقرة تستنتج أثراً سببياً لتبني أدوات الذكاء الاصطناعي على المشاركة الثقافية من بيانات مقطعية. الخطورة: عالية.",
  "EVIDENCE": ["ch03_v0.5.md#p12", "SRC-000011 (تصميم مقطعي)"],
  "ACTION_REQUIRED": "إعادة الصياغة ارتباطياً أو تقديم تصميم يسند السببية",
  "IN_REPLY_TO": null,
  "HANDOFF_ID": null,
  "DECISION_LEVEL": "L1"
}
